proc_keys,product_name
50000103867-fancyfeastgrainfreepatewetcatfoodclassicpatesalmonshrimpfeast3ozcan,"Fancy Feast Grain Free Pate Wet Cat Food, Classic Pate Salmon & Shrimp Feast, 3 oz. Can"
16000275638-totalbreakfastcerealwholegrainflakes16oz,"Total Breakfast Cereal, Whole Grain Flakes, 16 oz"
78742048369-greatvalueclassicranchsaladdressingdip16floz,"Great Value Classic Ranch Salad Dressing & Dip, 16 Fl Oz"
29243000028-lamodernafideomacaroni705oz,"La Moderna Fideo Macaroni, 7.05 oz"
29700001476-idahoanroastedgarlicmashedpotatoes4ozpouch,"Idahoan Roasted Garlic Mashed Potatoes, 4 oz Pouch"
37100033188-libbyscutgreenbeans145ozcan,"Libby's Cut Green Beans, 14.5 Oz Can"
78742229591-greatvaluefatfreeevaporatedmilk12oz,"Great Value Fat Free Evaporated Milk, 12 oz"
78742229591-greatvaluefatfreeevaporatedmilk12oz,"Great Value Fat Free Evaporated Milk, 12 oz"
39000600200-libbyscountrysausagegravycannedsausagegravy15oz,"Libby's Country Sausage Gravy, Canned Sausage Gravy, 15 Oz"
39000600200-libbyscountrysausagegravycannedsausagegravy15oz,"Libby's Country Sausage Gravy, Canned Sausage Gravy, 15 Oz"
39000086639-libbysviennasausageinchickenbrothcannedsausage46oz,"Libby's Vienna Sausage in Chicken Broth, Canned Sausage, 4.6 Oz"
39000086639-libbysviennasausageinchickenbrothcannedsausage46oz,"Libby's Vienna Sausage in Chicken Broth, Canned Sausage, 4.6 Oz"
50000836123-fancyfeastgravywetcatfoodgrilledtunafeast3ozcan,"Fancy Feast Gravy Wet Cat Food, Grilled Tuna Feast, 3 oz. Can"
78742236209-greatvaluealmondbarkvanilla24oz,"Great Value Almond Bark, Vanilla, 24 oz"
10900003308-reynolds330waxpaper75squareft,Reynolds 330 Wax Paper 75 Square ft.
44600015934-merchandise3377016cloroxwipesfreshscent4435count,Merchandise 3377016 Clorox Wipes Fresh Scent&#44; 35 Count
41167053508-goldbondultimatediabeticskinrelieflotionfragrancefree13ozbygoldbondultimate,"Gold Bond Ultimate Diabetic Skin Relief Lotion, Fragrance Free 13 oz by Gold Bond Ultimate"
50000103683-24packfriskiesshredswetcatfood55ozcansmultipleflavors,"(24 Pack) Friskies Shreds Wet Cat Food, 5.5 oz. Cans (Multiple Flavors)"
78742254593-greatvalueonionpowder325oz,"Great Value Onion Powder, 3.25 oz"
78742369556-greatvaluetomatopaste6oz,"Great Value Tomato Paste, 6 oz"
41789001215-maruchaninstantchickenflavorramennoodlesoup225oz,"Maruchan Instant Chicken Flavor Ramen Noodle Soup, 2.25 oz"
41789001215-maruchaninstantchickenflavorramennoodlesoup225oz,"Maruchan Instant Chicken Flavor Ramen Noodle Soup, 2.25 oz"
24300041501-littledebbiesnacksfudgerounds8ct,"Little Debbie Snacks Fudge Rounds, 8ct"
16000503304-bettycrockersuddenlypastasaladclassicpastasalad775oz,"Betty Crocker Suddenly Pasta Salad, Classic Pasta Salad, 7.75 oz"
41460398887-pioneercountrygravymix275oz,"Pioneer Country Gravy Mix, 2.75 oz"
16000275287-cheerioswholegrainoatsglutenfreebreakfastcereal18oz,"Cheerios Whole Grain Oats Gluten-Free Breakfast Cereal, 18 oz"
78742018669-greatvalueminimarshmallows10oz,"Great Value Mini Marshmallows, 10 oz"
41196010886-progressotraditionalchickennoodlesoup19oz,"Progresso Traditional, Chicken Noodle Soup, 19 oz"
41196010886-progressotraditionalchickennoodlesoup19oz,"Progresso Traditional, Chicken Noodle Soup, 19 oz"
52000012484-vancampsoriginalbeaneeweeneebeanshotdogs775oz,Van Camp's Original Beanee Weenee Beans & Hot Dogs 7.75 oz
52000012484-vancampsoriginalbeaneeweeneebeanshotdogs775oz,Van Camp's Original Beanee Weenee Beans & Hot Dogs 7.75 oz
52100155203-mccormickmildchiliseasoningmixpacket125oz,"McCormick Mild Chili Seasoning Mix Packet, 1.25 oz"
78742369426-greatvaluewholegreenbeans145ozcan,"Great Value Whole Green Beans, 14.5 oz, Can"
41789001253-maruchaninstantlunchshrimpflavornoodlesoup225oz,"Maruchan Instant Lunch Shrimp Flavor Noodle Soup, 2.25 Oz"
49200045503-dominopremiumpurecanegranulatedsugar4lb,"Domino Premium Pure Cane Granulated Sugar, 4 lb"
79426211109-ricosgourmetnachocheddarcheesesauce150oz,"Ricos Gourmet Nacho Cheddar Cheese Sauce, 15.0 OZ"
50000412204-24packfriskiesshredswetcatfood55ozcansmultipleflavors,"(24 Pack) Friskies Shreds Wet Cat Food, 5.5 oz. Cans (Multiple Flavors)"
78742119151-greatvaluemarshmallows10oz,"Great Value Marshmallows, 10 oz"
14800646085-hawaiianpunchfruitjuicyred1gallon,"Hawaiian Punch Fruit Juicy Red, 1 Gallon"
51000112859-campbellscannedbeansporkbeans11ozcan,"Campbell's Canned Beans, Pork & Beans, 11 oz. Can"
41789002816-maruchanramennoodlepicantechickenflavorsoup3oz,"Maruchan Ramen Noodle Picante Chicken Flavor Soup, 3 Oz"
78742254661-greatvaluelemonpepperseasoning425oz,"Great Value Lemon & Pepper Seasoning, 4.25 oz"
78742020631-greatvaluebeefbroth32oz,"Great Value Beef Broth, 32 oz"
78742209982-greatvaluepennepasta16oz,"Great Value Penne Pasta, 16 oz"
52000338775-gatoradethirstquenchersportsdrinklemonlime32ozbottle,"Gatorade Thirst Quencher Sports Drink, Lemon Lime, 32 oz Bottle"
50000100446-purinafriskiesgravywetcatfoodprimefiletschickentunadinneringravy55ozcan,"Purina Friskies Gravy Wet Cat Food, Prime Filets Chicken & Tuna Dinner in Gravy - 5.5 oz. Can"
78742372198-greatvalueconfectionerspowderedsugar32oz,"Great Value Confectioners Powdered Sugar, 32 oz"
76397001289-lacosteñagreenpickledjalapenopeppers26oz,"La Costeña Green Pickled Jalapeno Peppers, 26 oz"
41789001666-maruchaninstantcheddarcheeseramensoup225oz,"Maruchan Instant Cheddar Cheese Ramen Soup, 2.25 oz"
78742040011-4cansgreatvaluechunklighttunainwater5oz,"(4 Cans) Great Value Chunk Light Tuna in Water, 5 oz"
24300041303-littledebbieswisscakerolls12ct1331oz,"Little Debbie Swiss Cake Rolls, 12 ct, 13.31 oz"
44000046545-newtonssoftfruitchewyfigcookies10ozpack,"Newtons Soft & Fruit Chewy Fig Cookies, 10 oz Pack"
78742254654-greatvaluegarlicpowder34oz,"Great Value Garlic Powder, 3.4 oz"
78742254654-greatvaluegarlicpowder34oz,"Great Value Garlic Powder, 3.4 oz"
78742082752-greatvaluechunklighttunainwater5oz,"Great Value Chunk Light Tuna in Water, 5 oz"
78742017860-greatvalueclassicranchdressingdip36floz,"Great Value Classic Ranch Dressing & Dip, 36 fl oz"
78742199597-greatvaluereducedsodiumbrowngravymix087oz,"Great Value Reduced Sodium Brown Gravy Mix, 0.87 oz"
39400018100-bushscannedpintobeans16oz,"Bush's Canned Pinto Beans, 16 Oz"
39400018100-bushscannedpintobeans16oz,"Bush's Canned Pinto Beans, 16 Oz"
39400019749-bushscountrystylebakedbeansplantbasedproteincannedbeans28oz,"BUSH'S Country Style Baked Beans, Plant Based Protein, Canned Beans, 28 oz"
52100098609-mccormickbrowngravymix087oz,"McCormick Brown Gravy Mix, 0.87 oz"
49000028911-dietcokecolasodapop12floz12packcans,"Diet Coke Cola Soda Pop, 12 Fl Oz, 12 Pack Cans"
76406021802-jumexmangonectarfromconcentrate113floz,"Jumex Mango Nectar from Concentrate, 11.3 Fl. oz."
50000424948-friskiespatewetcatfood55ozcans,"Friskies Pate Wet Cat Food, 5.5 oz. Cans"
78742209999-greatvaluerotinipasta16oz,"Great Value Rotini Pasta, 16 oz"
76171803931-littletreesairfreshenerblackicefragrance1pack,Little Trees Air Freshener Black Ice Fragrance 1-Pack
44000031114-ritzoriginalcrackers137oz,"RITZ Original Crackers, 13.7 oz"
41789001055-maruchaninstantlunchlimeflavorwshrimpinstantlunch225oz,"Maruchan Instant Lunch Lime Flavor w/Shrimp Instant Lunch, 2.25 oz"
12000813313-starbucksfrappuccinovanillachilledcoffeedrink137flozbottle,Starbucks Frappuccino Vanilla Chilled Coffee Drink 13.7 fl. oz. Bottle
50000429943-24packfancyfeastgrainfreepatewetcatfood3ozcan,"(24 Pack) Fancy Feast Grain Free Pate Wet Cat Food, 3 oz. Can"
50000429943-fancyfeastgrainfreepatewetcatfoodclassicpatechickenfeast3ozcan,"Fancy Feast Grain Free Pate Wet Cat Food, Classic Pate Chicken Feast, 3 oz. Can"
78742233505-greatvalueultrasoftfacialtissues,Great Value Ultra Soft Facial Tissues
78742233505-greatvalueeverydaysoftfacialtissues2ply80count,"Great Value Everyday Soft Facial Tissues, 2 Ply, 80 Count"
31200016058-oceanspraysalsadearandano397gr,OCEAN SPRAY SALSA DE ARANDANO 397GR
78742082554-greatvaluechunklighttunainvegetableoil5oz,"Great Value Chunk Light Tuna in Vegetable Oil, 5 oz"
70470003238-yoplaitoriginalyogurtfrenchvanillalowfatyogurt6oz,"Yoplait Original Yogurt, French Vanilla, Low Fat Yogurt, 6 oz"
70470003139-yoplaitoriginalyogurtstrawberrybananalowfatyogurt6oz,"Yoplait Original Yogurt, Strawberry Banana, Low Fat Yogurt, 6 oz"
75669115105-iberiacoconutwater169floz1count,"Iberia Coconut Water, 16.9 Fl Oz, 1 Count"
70662096338-nissinbowlnoodleshotspicybeefflavorramennoodlesoup328oz,"Nissin Bowl Noodles Hot & Spicy Beef Flavor Ramen Noodle Soup, 3.28 Oz"
70662096338-nissinbowlnoodleshotspicybeefflavorramennoodlesoup328oz,"Nissin Bowl Noodles Hot & Spicy Beef Flavor Ramen Noodle Soup, 3.28 Oz"
54100794130-armourstarviennasausageoriginalflavorcannedsausage46ozpackof6,"Armour Star Vienna Sausage, Original Flavor, Canned Sausage, 4.6 OZ (Pack of 6)"
29700021429-idahoansourcreamchivesmashedpotatoes4ozpouch,"Idahoan Sour Cream & Chives Mashed Potatoes, 4 oz Pouch"
78742072760-greatvaluereducedsodiumchickenbroth32oz,"Great Value Reduced Sodium Chicken Broth, 32 oz"
78742245737-greatvaluechiliseasoningmix125oz,"Great Value Chili Seasoning Mix, 1.25 oz"
41789001314-maruchaninstantlunchchickenflavorramennoodlesoup225oz6count,"Maruchan Instant Lunch Chicken Flavor Ramen Noodle Soup, 2.25 oz, 6 count"
29700001384-idahoanbabyredsmashedpotatoes41ozpouch,"Idahoan Baby Reds Mashed Potatoes, 4.1 oz Pouch"
41167053508-goldbondultimatelotiondesoulagementdelapeaudiabétiquesansparfum13ozpargoldbondultimate,"Gold Bond Ultimate Lotion de soulagement de la peau diabétique, sans parfum 13 oz par Gold Bond Ultimate"
78742254685-greatvalueitalianseasoning095oz,"Great Value Italian Seasoning, 0.95 Oz"
78742433943-greatvaluemediumdicedgreenchiles4oz,"Great Value Medium Diced Green Chiles, 4 Oz"
49000031652-dasanipurifiedwater169floz24packbottles,"Dasani Purified Water, 16.9 Fl Oz, 24 Pack Bottles"
78742369686-greatvaluepineappleslicesin100juice20oz,"Great Value Pineapple Slices in 100% Juice, 20 Oz"
644209307500-duncanhinesclassicwhitecakemix1525oz,"Duncan Hines Classic White Cake Mix, 15.25 Oz"
51000025494-pregopastasaucetraditionalitaliantomatosauce24ouncejar,"Prego Pasta Sauce, Traditional Italian Tomato Sauce, 24 Ounce Jar"
64144043026-chefboyardeebeefaroni15oz,"Chef Boyardee Beefaroni, 15 oz"
43000955703-koolaidunsweetenedpinklemonadenaturallyflavoredpowderedsoftdrinkmix023ozpacket,"Kool-Aid Unsweetened Pink Lemonade Naturally Flavored Powdered Soft Drink Mix, 0.23 oz Packet"
43000955703-koolaidunsweetenedpinklemonadenaturallyflavoredpowderedsoftdrinkmix023ozpacket,"Kool-Aid Unsweetened Pink Lemonade Naturally Flavored Powdered Soft Drink Mix, 0.23 oz Packet"
64144282630-rotelmilddicedtomatoesandgreenchilies10oz,"ROTEL Mild Diced Tomatoes and Green Chilies, 10 oz."
29700001452-idahoanfourcheesemashedpotatoes4ozpouch,"Idahoan Four Cheese Mashed Potatoes, 4 oz Pouch"
78000082135-drpeppersoda12flozcans24pack,"Dr Pepper Soda, 12 fl oz cans, 24 pack"
12000007460-dietmountaindewcitrussodapop2literbottle,"Diet Mountain Dew Citrus Soda Pop, 2 Liter Bottle"
41789007019-maruchanyakisobajapanesechickennoodles4oz,"Maruchan Yakisoba Japanese Chicken Noodles, 4 oz."
46000288765-oldelpasomildtacoseasoningmixpacket1oz,"Old El Paso Mild Taco Seasoning Mix Packet, 1 oz."
364613045620-picotsaldeuvas12unités,"Picot Sal de Uvas, 12 unités"
27000390054-huntstomatosauce100naturaltomatosauce8oz,"Hunt's Tomato Sauce, 100% Natural Tomato Sauce, 8 Oz"
364613045620-picotsaldeuvaseffervescentpowderforsolutionantacidassistsyouinrelievingheartburnrefluxstomachheavinessneutralizesstomachacid12count,"Picot Sal de Uvas, Effervescent Powder for Solution, Antacid, Assists you in Relieving Heartburn, Reflux, Stomach Heaviness, Neutralizes Stomach Acid, 12 Count."
16000509405-bettycrockersuddenlypastasaladranchandbacondrymeals75oz,"Betty Crocker Suddenly Pasta Salad, Ranch and Bacon, Dry Meals, 7.5 oz"
78742048369-greatvalueclassicranchsaladdressingdip16floz,"Great Value Classic Ranch Salad Dressing & Dip, 16 Fl Oz"
781138715164-onthebordermexicangrillcantinathinstortillachips16oz,"On the Border Mexican Grill & Cantina Thins Tortilla Chips, 16 Oz."
76397001289-lacosteñagreenpickledjalapenopeppers26oz,"La Costeña Green Pickled Jalapeno Peppers, 26 oz"
78742067353-greatvalueviennasausage46ozcan,"Great Value Vienna Sausage, 4.6 oz Can"
29243000028-lamodernafideomacaroni705oz,"La Moderna Fideo Macaroni, 7.05 oz"
78742228679-greatvaluegardenrotinipasta16oz,"Great Value Garden Rotini Pasta, 16 Oz"
78742085845-greatvaluefettuccine16oz,"Great Value Fettuccine, 16 oz"
78742230511-greatvaluerigatoni16oz,"Great Value Rigatoni, 16 oz"
41789002137-maruchanramennoodleporkflavorsoup3oz,"Maruchan Ramen Noodle Pork Flavor Soup, 3 Oz"
29700021429-idahoansourcreamchivesmashedpotatoes4ozpouch,"Idahoan Sour Cream & Chives Mashed Potatoes, 4 oz Pouch"
46000288765-oldelpasomildtacoseasoningmixpacket1oz,"Old El Paso Mild Taco Seasoning Mix Packet, 1 oz."
41331124669-goyablackbeans155oz,"Goya Black Beans, 15.5 Oz"
41331124669-goyablackbeans155oz,"Goya Black Beans, 15.5 Oz"
37600138727-spamclassic7gofprotein12oz,"SPAM Classic, 7 g of protein, 12 oz"
51000112859-campbellscannedbeansporkbeans11ozcan,"Campbell's Canned Beans, Pork & Beans, 11 oz. Can"
64144282630-rotelmilddicedtomatoesandgreenchilies10oz,"ROTEL Mild Diced Tomatoes and Green Chilies, 10 oz."
41789007071-maruchanyakisobateriyakibeefnoodles4oz,"Maruchan Yakisoba Teriyaki Beef Noodles, 4 oz."
41789007071-maruchanyakisobateriyakibeefnoodles4oz,"Maruchan Yakisoba Teriyaki Beef Noodles, 4 oz."
54100925022-armourviennasausageoriginal46ozcan,"Armour Vienna Sausage, Original, 4.6 oz Can"
43000956878-koolaidunsweetenedmixedberryartificiallyflavoredpowderedsoftdrinkmix022ozpacket,"Kool-Aid Unsweetened Mixed Berry Artificially Flavored Powdered Soft Drink Mix, 0.22 oz Packet"
41789002120-maruchanramennoodlebeefflavorsoup3oz,"Maruchan Ramen Noodle Beef Flavor Soup, 3 Oz"
24300044311-littledebbiepowderedminidonutsbagged10oz,"Little Debbie Powdered Mini Donuts (bagged), 10 oz"
50000445691-24packfriskiesshredswetcatfood55ozcansmultipleflavors,"(24 Pack) Friskies Shreds Wet Cat Food, 5.5 oz. Cans (Multiple Flavors)"
43000028254-koolaidjammerstropicalpunchartificiallyflavoredsoftdrink10ctbox6flozpouches,"Kool-Aid Jammers Tropical Punch Artificially Flavored Soft Drink, 10 ct Box, 6 fl oz Pouches"
39000008204-ortegaoriginaltacoseasoningmix125ozpacket,Ortega Original Taco Seasoning Mix 1.25 oz. Packet
39000008204-ortegaoriginaltacoseasoningmix125ozpacket,Ortega Original Taco Seasoning Mix 1.25 oz. Packet
41789002816-maruchanramennoodlepicantechickenflavorsoup3oz,"Maruchan Ramen Noodle Picante Chicken Flavor Soup, 3 Oz"
9800895007-nutellachocolatehazelnutspread13ozjar5pack,"Nutella Chocolate Hazelnut Spread, 13 oz Jar, 5 Pack"
41789001222-maruchaninstantlunchbeefflavornoodlesoup225oz,"Maruchan Instant Lunch Beef Flavor Noodle Soup, 2.25 Oz"
37100036622-libbyswholekernelsweetcorn1525oz,"Libby's Whole Kernel Sweet Corn, 15.25 Oz"
41331124669-ealpremiumharicotsnoirsgoya,E-AL PREMIUM HARICOTS NOIRS GOYA
41789002144-maruchanramennoodleorientalflavorsoup3oz,"Maruchan Ramen Noodle Oriental Flavor Soup, 3 Oz"
41789001420-maruchaninstanthotspicybeeframensoup225oz,"Maruchan Instant Hot & Spicy Beef Ramen Soup, 2.25 oz"
41789001574-maruchaninstantlunchroastchickenflavorsoup225oz,"Maruchan Instant Lunch Roast Chicken Flavor Soup, 2.25 Oz"
41789001444-maruchaninstantlunchhotspicyshrimpflavornoodlesoup225oz,"Maruchan Instant Lunch Hot & Spicy Shrimp Flavor Noodle Soup, 2.25 Oz"
70662087299-nissinteriyakichickenflavorchowmeinnoodles4oz,"Nissin Teriyaki Chicken Flavor Chow Mein Noodles, 4 oz"
12000001130-pepsicolaflavoredsodapop2literbottle,"Pepsi Cola Flavored Soda Pop, 2 Liter Bottle"
12000286193-pureleafsweettea185flozbottle,Pure Leaf Sweet Tea 18.5 fl. oz. Bottle
75669115105-iberiacoconutwater169floz1count,"Iberia Coconut Water, 16.9 Fl Oz, 1 Count"
78742086774-greatvaluenosaltaddedsweetpeascannedsweetpeas15ozcan,"Great Value No Salt Added Sweet Peas, Canned Sweet Peas, 15 oz Can"
50000100422-purinafriskieswetcatfoodprimefiletswithsalmonbeefinsauce55ozcan,"Purina Friskies Wet Cat Food, Prime Filets With Salmon & Beef in Sauce - 5.5 oz. Can"
50000579907-friskieswetcatfoodshredswithwhitefishsardinesinsauce55ozcan,"Friskies Wet Cat Food, Shreds With Whitefish & Sardines in Sauce, 5.5 oz. Can"
50313151357-carmelachickensausageandbouillion5ozcan,"Carmela Chicken Sausage and Bouillion, 5 oz Can"
50000429547-fancyfeastgrainfreepatewetcatfoodtenderbeeffeast3ozcan,"Fancy Feast Grain Free Pate Wet Cat Food, Tender Beef Feast, 3 oz. Can"
43000956878-koolaidunsweetenedmixedberryartificiallyflavoredpowderedsoftdrinkmix022ozpacket,"Kool-Aid Unsweetened Mixed Berry Artificially Flavored Powdered Soft Drink Mix, 0.22 oz Packet"
50000429745-fancyfeastgrainfreepatewetcatfoodtenderbeefchickenfeast3ozcan,"Fancy Feast Grain Free Pate Wet Cat Food, Tender Beef & Chicken Feast, 3 oz. Can"
50000579907-24packfriskiesshredswetcatfood55ozcansmultipleflavors,"(24 Pack) Friskies Shreds Wet Cat Food, 5.5 oz. Cans (Multiple Flavors)"
364613045620-picotsaldeuvas12count,"Picot Sal De Uvas, 12-Count"
41800716005-welchswelchbebidauvaroja750ml,WELCHS WELCH BEBIDA UVA ROJA 750 ML
41800715008-welchswelchbebidauvablanca750ml,WELCHS WELCH BEBIDA UVA BLANCA 750 ML
50000421541-friskiescattreatspartymixoriginalcrunch21ozpouch,"Friskies Cat Treats, Party Mix Original Crunch - 2.1 oz. Pouch"
27000442128-manwichoriginalsloppyjoesaucecannedsauce15oz,"Manwich Original Sloppy Joe Sauce, Canned Sauce, 15 OZ"
43000285558-stovetopturkeystuffingmix,Stove Top Turkey Stuffing Mix
87684000991-caprisunstrawberrykiwinaturallyflavoredjuicedrinkblend10ctbox6flozpouches,"Capri Sun Strawberry Kiwi Naturally Flavored Juice Drink Blend, 10 ct Box, 6 fl oz Pouches"
49000042559-cocacolazerosugar355mlcans12pack,"Coca-Cola Zero Sugar 355mL Cans, 12 Pack"
64144043026-ecbadbeefaroni,E-CBAD BEEFARONI
64144043224-ecbadspagboulettesvian,E-CBAD SPAG BOULETTES VIAN
50000100446-24packfriskiesprimefiletswetcatfood55ozcansmultipleflavors,"(24 Pack) Friskies Prime Filets Wet Cat Food, 5.5 oz. Cans (Multiple Flavors)"
52100096902-mccormickmixgravyaujus1ozpackof12,"Mc Cormick, Mix Gravy Aujus, 1 Oz, (Pack Of 12)"
64144043064-ecbadchefbydminiraviol,E-CBAD CHEF-BYD MINI RAVIOL
64144282630-rotelmilddicedtomatoesandgreenchilies10ounce12pack,"ROTEL Mild Diced Tomatoes and Green Chilies, 10 Ounce, 12 Pack"
24300041204-littledebbienutybars,LITTLE DEBBIE NUTY BARS
21000658978-kraftmccheesespir156gr,KRAFT MC&CHEESE SPIR 156 GR
16000430549-bettycrockerbcpastelamarillo,BETTY CROCKER BC PASTEL AMARILLO
37600223188-hormelchilibeans425gr,HORMEL CHILI BEANS 425GR
24300041464-pastelitolittledebbiezebra,PASTELITO LITTLE  DEBBIE  ZEBRA
25500005188-folgersclassicrst136kg,FOLGERS CLASSIC RST 1.36KG
37100033188-libbychicharosenmitadesenlata411gr,LIBBY CHICHAROS EN MITADES EN LATA 411GR
71100005516-hiddenvalleyhvaderezoorigranchsgluten473ml,HIDDEN VALLEY HV ADEREZO ORIG RANCH S GLUTEN 473 ML
644209307494-duncanhinesamarillo,DUNCAN HINES AMARILLO
37600241939-hormelchilisinfrijoles425gr,HORMEL CHILI SIN FRIJOLES 425GR
24300041020-littledebbiebollosconmiel301gr,LITTLE DEBBIE BOLLOS CON MIEL 301GR
24300041563-littledebbiepastelitoarbolnavidenov,LITTLE DEBBIE PASTELITO ARBOL NAVIDENO V
24300041303-littledebbiepastelitoswissrolls,LITTLE DEBBIE PASTELITO SWISS ROLLS
36200013694-ragudoublealfredo453grfrasco,RAGU DOUBLE ALFREDO 453 GR FRASCO
36200002506-ragusalsapastatradicionalfco680gr,RAGU SALSA PASTA TRADICIONAL FCO 680GR
50000836123-fancyfeastminifiletesatun85g,FANCY FEAST MINI FILETES ATUN 85G
50000429448-fancyfeastmoussesalmon85g,FANCY FEAST MOUSSE SALMON 85G
43000955635-koolaidunsweetenedgrapeartificiallyflavoredpowdereddrinkmix014ozpacket,"Kool-Aid Unsweetened Grape Artificially Flavored Powdered Drink Mix, 0.14 oz. Packet"
38000138416-pringlesoriginalperfectlyflavorednoartificialingredientspotatocrispschips52ounce,"Pringles Original Perfectly Flavored No Artificial Ingredients Potato Crisps Chips, 5.2 Ounce"
38000138577-pringlespotatocheddarcheeseperfectlyflavoredcrispsandtastychips55ounce,"Pringles Potato Cheddar Cheese Perfectly Flavored Crisps and Tasty Chips, 5.5 Ounce"
64144043064-ecbadminiravchefboyar,E-CBAD MINI RAV CHEF BOYAR
37297914475-eproduitalimentaremasecacornflour,E-PRODUIT ALIMENTARE MASECA CORN FLOUR
64144043026-chefboyardeebeefaroni15oz,Chef Boyardee Beefaroni 15 Oz
64144043156-ecbadchefbydbeefraviol,E-CBAD CHEF-BYD BEEF RAVIOL
64144043156-ecbadraviolboeufchefbyd,E-CBAD RAVIOL BOEUF CHEFBYD
64144043224-chefboyardeespaghettimeatballs1475oz,Chef Boyardee Spaghetti & Meatballs - 14.75 Oz
41331124669-goyapremiumblackbeans155ozpackof24,"Goya Premium Black Beans, 15.5 OZ (Pack of 24)"
52100034911-mccormickoriginaltacoseasoningmix1oz28g,"McCormick, Original Taco Seasoning Mix, 1 oz (28 g)"
19800401092-dranomaxgeldrainclogremoverandcleanerforshowerorsinkdrainsunclogsandremoveshairsoapscumblockages80oz,"Drano Max gel Drain clog Remover and cleaner for Shower or Sink Drains, Unclogs and Removes Hair, Soap Scum, Blockages, 80 oz"
49000045840-lalvindriedwineyeastec1118packof10,Lalvin Dried Wine Yeast EC #1118 (Pack of 10)
46000288765-oldelpasotacomildseasoningmix1ozpacket,"Old El Paso Taco Mild Seasoning Mix, 1 oz Packet"
39000600200-libbyscountrysausagegravy15ouncepackof12,"Libby's Country Sausage Gravy, 15 Ounce, Pack of 12"
16000430549-bettycrockersupermoistyellowcakemix1525oz,"Betty Crocker Super Moist Yellow Cake Mix, 15.25 oz"
76406023103-jumexstrawberryandbanananectar113ozpackof24,"Jumex Strawberry And Banana Nectar, 11.3 OZ (Pack of 24)"
78742230511-barbiesilkstonesuiteretreatfashionmodelcollectiongoldlabel12doll,"Barbie Silkstone Suite Retreat Fashion Model Collection Gold Label 12"" Doll"
37600223188-hormel®chiliwithbeans15ozcan,HORMEL® Chili with Beans 15 oz. Can
37600241939-hormelchilinobeans15oz,HORMEL CHILI NO BEANS 15 oz
41167053508-goldbondultimatediabeticsdryskinreliefhydratinglotion13oz,"Gold Bond Ultimate Diabetics' Dry Skin Relief Hydrating Lotion, 13 oz"
43000956878-koolaidmixedberryflavoredunsweetenedcaffeinefreepowdereddrinkmix192packets,Kool-Aid Mixed Berry Flavored Unsweetened Caffeine Free Powdered Drink Mix (192 Packets)
25500005188-folgersclassicroastgroundcoffee136kg,"Folgers Classic Roast Ground Coffee, 1.36 kg"
29700001414-idahoanbutteryhomestyle®mashedpotatoes4ozpouch,"Idahoan Buttery Homestyle® Mashed Potatoes, 4 oz Pouch"
78742352961-greatvaluevegetableoil48floz,"Great Value Vegetable Oil, 48 fl oz"
76808280081-barilla®classicblueboxspaghettipasta16oz,"Barilla® Classic Blue Box Spaghetti Pasta, 16 oz"
70662096338-nissinbowlnoodleshotandspicybeefflavorenrichedflourramennoodlesoup328ounce,"Nissin Bowl Noodles Hot and Spicy Beef Flavor Enriched Flour Ramen Noodle Soup, 3.28 Ounce"
28000517809-lalacherasweetenedcondensedmilk14ozpackof24,"La Lachera Sweetened Condensed Milk, 14 OZ (Pack of 24)"
76397001289-lacostenagreenpickledjalapenopeppers26ozpackof12,"La Costena Green Pickled Jalapeno Peppers, 26 OZ (Pack of 12)"
28000517205-nestlecreamlite76ozpackof24,"Nestle, Cream Lite, 7.6 Oz, (Pack Of 24)"
37000716501-fixodentcompleteoriginaldentureadhesivecream24oz3pack,"Fixodent Complete Original Denture Adhesive Cream, 2.4 oz, 3 PACK"
37000716501-fixodentcompleteoriginaldentureadhesivecream24oz3pack,"Fixodent Complete Original Denture Adhesive Cream, 2.4 oz, 3 Pack"
29243000028-lamodernapastafideo7ozpackof20,"La Moderna, Pasta Fideo, 7 Oz, (Pack Of 20)"
29700001414-idahoanmashedpotatoesbutteryhomestyle4ouncepackagepackof12,Idahoan Mashed Potatoes Buttery Homestyle 4-Ounce Package (Pack of 12)
27000390146-huntstomatoesauce15oz24pack,Hunts Tomatoe Sauce 15 oz. 24 pack
46500733321-scjohnson73332linglade8ozairfreshenercleanlinenscentpackof12,SC Johnson 73332 LIN Glade 8oz Air Freshener - Clean Linen Scent pack of 12
51000024312-swanson chickenbroth145ozcan,"Swanson Chicken Broth, 14.5 oz. Can"
37000716501-fixodentcompleteoriginaldentureadhesivecream24floz3pk,"Fixodent Complete Original Denture Adhesive Cream (2.4 fl. oz., 3 pk.)"
37297914475-masecainstantcornmasamix44lbs,Maseca Instant Corn Masa Mix (4.4 lbs.)
44600015934-cloroxdisinfectingwipesfreshscent35count,"Clorox Disinfecting Wipes, Fresh Scent, 35 Count"
44600015934-cloroxdisinfectingwipesfreshscent35count,"Clorox Disinfecting Wipes, Fresh Scent, 35 Count"
16000275638-totalcerealwithwholegrainflakes16oz,"Total, Cereal, with Whole Grain Flakes, 16 oz"
44000032197-nabiscochipsahoyoriginalchocolatechipcookies13oz,"Nabisco Chips Ahoy! Original Chocolate Chip Cookies, 13 Oz."
44000034207-belvitasoftbakedbananabreadbreakfastbiscuits88oz,"belVita Soft Baked Banana Bread Breakfast Biscuits, 8.8 Oz."
52100096902-mccormickclassicaujusgravymixseasoningpacket1oz,"McCormick Classic Au Jus Gravy Mix Seasoning Packet, 1 oz"
51500255162-jifcreamypeanutbutter16ounce,"Jif Creamy Peanut Butter, 16-Ounce"
41000003622-liptonrecipesecretsonionflavorsoupanddipmix2oz2count,"Lipton Recipe Secrets Onion Flavor Soup and Dip Mix, 2 oz 2 Count"
78742369457-greatvaluefrenchstylegreenbeans145oz,"Great Value French Style Green Beans, 14.5 Oz"
39400018100-bushsbestpintobeans16oz,"Bushs Best Pinto Beans, 16 oz"
28400641326-doritoscoolranchflavoredtortillachips975oz,"Doritos Cool Ranch Flavored Tortilla Chips, 9.75 Oz."
33200011101-armhammerpurebakingsoda1lb,"Arm & Hammer Pure Baking Soda, 1 lb"
28400589895-cheetoscrunchyflaminhotcheeseflavoredsnacks85ozbag,"Cheetos Crunchy Flamin' Hot Cheese Flavored Snacks, 8.5 oz Bag"
28400147408-sunchipswholegrainsnacksgardensalsa7oz,"SunChips Whole Grain Snacks, Garden Salsa, 7 Oz"
16571910327-talkingrainbeverage9335019eaugazifielafraisekiwiice17oz,Talking Rain Beverage 9335019 Eau gaz-ifi-e - la fraise Kiwi Ice 17 oz
12000809965-mtndewcitrussoda1212flozcans,Mtn Dew Citrus Soda 12-12 fl. oz. Cans
38000138416-pringlesoriginalpotatocrisps52oz,"Pringles Original Potato Crisps, 5.2 oz"
12000809941-pepsi®cola1212flozcans,Pepsi® Cola 12-12 fl. oz. Cans
37600138727-spam®classic12oz,SPAM® Classic 12 oz.
