proc_keys,product_name
78742228037-greatvaluepuregranulatedsugar4lb,"Great Value Pure Granulated Sugar, 4 lb"
78742351414-greatvalueoriginalsaltinecrackers16oz4count,"Great Value Original Saltine Crackers, 16 oz, 4 Count"
39000045049-libbys100purecannedpumpkin15oz,Libby's 100% Pure Canned Pumpkin 15 oz.
39000045049-libbys100purecannedpumpkin15oz,Libby's 100% Pure Canned Pumpkin 15 oz.
70470003078-yoplaitoriginalharvestpeachglutenfreelowfatyogurt6ozcup,"Yoplait Original Harvest Peach Gluten-Free Low-Fat Yogurt, 6 oz. Cup"
38900001438-dolepineappleslicesin100pineapplejuicecannedpineapple20oz,"Dole Pineapple Slices in 100% Pineapple Juice, Canned Pineapple, 20 oz"
38900001438-dolepineappleslicesin100pineapplejuicecannedpineapple20oz,"Dole Pineapple Slices in 100% Pineapple Juice, Canned Pineapple, 20 oz"
78742110554-greatvaluelightredkidneybeans155oz,"Great Value Light Red Kidney Beans, 15.5 Oz"
78742110554-greatvaluelightredkidneybeans155oz,"Great Value Light Red Kidney Beans, 15.5 Oz"
78742017914-greatvalue100purepumpkin15oz,"Great Value 100% Pure Pumpkin, 15 oz"
46500733321-gladeroomsprayairfreshener8ouncecleanlinensingle,"Glade Room Spray Air Freshener, 8 Ounce, Clean Linen, Single"
51000024312-swansonchickenbroth145ouncecan,"Swanson Chicken Broth, 14.5 Ounce Can"
49000024708-spritecaffeinefreelemonlimesodapop169floz6packbottles,"Sprite Caffeine-Free Lemon Lime Soda Pop, 16.9 Fl Oz, 6 Pack Bottles"
24300041013-littledebbieoatmealcremepies12ct162oz,"Little Debbie Oatmeal Creme Pies, 12 ct, 16.2 oz"
24300041204-littledebbienuttybuddywaferbars12ct120oz,"Little Debbie Nutty Buddy Wafer Bars, 12 ct, 12.0 oz"
49000010633-dietcokecolasodapop12floz24packcans,"Diet Coke Cola Soda Pop, 12 Fl Oz, 24 Pack Cans"
42800435897-totinospepperonipartypizzapackfrozenpizza4count,"Totino's Pepperoni Party Pizza Pack! Frozen Pizza, 4 count"
50000303021-coffeematetheoriginalpowdercoffeecreamer353ozcanisternondairylactosefreeglutenfreecreamer,"COFFEE MATE The Original Powder Coffee Creamer 35.3 Oz. Canister | Non-dairy, Lactose Free, Gluten Free Creamer"
50000303021-nestlecoffeemateoriginalpowderedcoffeecreamer353oz,Nestle Coffee mate Original Powdered Coffee Creamer 35.3 oz.
12000504051-pepsicolasodapop169floz6packbottles,"Pepsi Cola Soda Pop, 16.9 Fl Oz, 6 Pack Bottles"
78742065311-greatvaluemayonnaise30flozjar,"Great Value Mayonnaise, 30 Fl Oz Jar"
78742065311-greatvaluemayonnaise30flozjar,"Great Value Mayonnaise, 30 Fl Oz Jar"
12000809941-pepsicolasodapop12floz12packcans,"Pepsi Cola Soda Pop, 12 Fl Oz, 12 Pack Cans"
12000504051-pepsicolasodapop169floz6packbottles,"Pepsi Cola Soda Pop, 16.9 Fl Oz, 6 Pack Bottles"
12000809941-pepsicolasodapop12floz12packcans,"Pepsi Cola Soda Pop, 12 Fl Oz, 12 Pack Cans"
29700001414-idahoanbutteryhomestylemashedpotatoes4ozpouch,"Idahoan Buttery Homestyle Mashed Potatoes, 4 oz Pouch"
78742369433-greatvaluenosaltaddedcutgreenbeans145oz,"Great Value No Salt Added Cut Green Beans, 14.5 Oz"
31200016058-oceansprayjelliedcranberrysauce14ozcan,"Ocean Spray Jellied Cranberry Sauce, 14 oz Can"
78742114538-greatvaluerestaurantstylewhitecorntortillachips13oz,"Great Value Restaurant Style White Corn Tortilla Chips, 13 oz"
78742352558-greatvaluedistilledwhitevinegar128floz,"Great Value Distilled White Vinegar, 128 fl oz"
24100106851-cheezitcheesecrackersbakedsnackcrackersofficeandkidssnacksoriginal124oz1box,"Cheez-It Cheese Crackers, Baked Snack Crackers, Office and Kids Snacks, Original, 12.4oz, 1 Box"
51000012616-campbellscondensedcreamofmushroomsoup105ouncecan,"Campbell's Condensed Cream of Mushroom Soup, 10.5 Ounce Can"
24100106851-cheezitcheesecrackersbakedsnackcrackersofficeandkidssnacksoriginal124oz1box,"Cheez-It Cheese Crackers, Baked Snack Crackers, Office and Kids Snacks, Original, 12.4oz, 1 Box"
28400596688-cheetospuffcheeseflavoredsnack8oz,"Cheetos Puff Cheese Flavored Snack, 8 oz"
28400596688-cheetospuffcheeseflavoredsnack8oz,"Cheetos Puff Cheese Flavored Snack, 8 oz"
39000045124-libbys100purecannedpumpkin29oz,Libby's 100% Pure Canned Pumpkin 29 oz.
44000031138-ritzfreshstacksoriginalcrackers8count118oz,"Ritz Fresh Stacks Original Crackers, 8 Count, 11.8 Oz"
49000012781-cocacolaoriginalsodapop12floz24packcans,"Coca-Cola Original Soda Pop, 12 Fl Oz, 24 Pack Cans"
39000045124-libbys100purecannedpumpkin29oz,Libby's 100% Pure Canned Pumpkin 29 oz.
44000031138-ritzfreshstacksoriginalcrackers8count118oz,"Ritz Fresh Stacks Original Crackers, 8 Count, 11.8 Oz"
44000882105-ritzpeanutbuttersandwichcrackers8138ozsnackpacks,"RITZ Peanut Butter Sandwich Crackers, 8 - 1.38 oz Snack Packs"
44000882105-ritzpeanutbuttersandwichcrackers8138ozsnackpacks,"RITZ Peanut Butter Sandwich Crackers, 8 - 1.38 oz Snack Packs"
78742369686-greatvaluepineappleslicesin100juice20oz,"Great Value Pineapple Slices in 100% Juice, 20 Oz"
28000517809-nestlelalecherasweetenedcondensedmilk14oz,Nestle La Lechera Sweetened Condensed Milk 14 oz.
50000010110-nestlecarnationevaporatedmilkvitamindadded132oz,"Nestle Carnation Evaporated Milk, Vitamin D Added 13.2 oz."
28000215804-nestletollhousesemisweetchocolatechips12oz,Nestle Toll House Semi Sweet Chocolate Chips 12 oz.
50000159918-nestlecarnationlowfat2evaporatedmilk12floz,Nestle Carnation Lowfat 2% Evaporated Milk 12 fl oz.
28000517205-nestlemediacrematablecream76floz,Nestle Media Crema Table Cream 7.6 fl oz.
13800103406-stouffersmacaronicheesefrozenmeal12oz,Stouffer's Macaroni & Cheese Frozen Meal 12 oz.
28000517205-nestlemediacrematablecream76floz,Nestle Media Crema Table Cream 7.6 fl oz.
50000010110-nestlecarnationevaporatedmilkvitamindadded132oz,"Nestle Carnation Evaporated Milk, Vitamin D Added 13.2 oz."
50000159918-nestlecarnationlowfat2evaporatedmilk12floz,Nestle Carnation Lowfat 2% Evaporated Milk 12 fl oz.
39400016144-bushsoriginalbakedbeanscanned28oz,"BUSH'S Original Baked Beans, Canned, 28 oz"
52000338775-gatoradethirstquenchersportsdrinklemonlime32ozbottle,"Gatorade Thirst Quencher Sports Drink, Lemon Lime, 32 oz Bottle"
52000208085-gatoradefrostthirstquenchersportsdrinkglacierfreeze20ozbottles8count,"Gatorade Frost Thirst Quencher Sports Drink, Glacier Freeze, 20 oz Bottles, 8 Count"
24300041020-littledebbiehoneybuns6ct106oz,"Little Debbie Honey Buns, 6 ct, 10.6 oz"
52000104073-gatoradefiercegreenappledrink32floz,"Gatorade Fierce Green Apple Drink, 32 Fl. Oz."
52000132243-gatoradethirstquencherlimecucumberdrink32floz,"Gatorade Thirst Quencher Lime Cucumber Drink, 32 Fl. Oz."
52000338751-gatoradethirstquencherfruitpunchsportsdrink32floz,"Gatorade Thirst Quencher Fruit Punch Sports Drink, 32 Fl. Oz."
52000320169-gatoradethirstquencherfrostglacierfreezesportsdrink32floz,"Gatorade Thirst Quencher Frost Glacier Freeze Sports Drink, 32 Fl. Oz."
41800716005-welchsnonalcoholicsparklingjuicecocktailredgrape254flozbottle,"Welch's Non-Alcoholic Sparkling Juice Cocktail, Red Grape, 25.4 fl oz Bottle"
31200016034-oceanspraywholeberrycranberrysauce14oz,"Ocean Spray Whole Berry Cranberry Sauce, 14 oz"
31200016034-oceanspraywholeberrycranberrysauce14oz,"Ocean Spray Whole Berry Cranberry Sauce, 14 oz"
80000495242-starkist®chunklighttunainwater26ozpouchseafood,StarKist® Chunk Light Tuna In Water - 2.6oz Pouch seafood
24600010016-mortonsaltplain26ounce,"Morton Salt, Plain, 26 Ounce"
24600010016-mortonsaltplain26ounce,"Morton Salt, Plain, 26 Ounce"
16000509405-bettycrockersuddenlypastasaladranchandbacondrymeals75oz,"Betty Crocker Suddenly Pasta Salad, Ranch and Bacon, Dry Meals, 7.5 oz"
78742075761-greatvalueblackbeans1525ozcan,"Great Value Black Beans, 15.25 oz Can"
39400019749-bushscountrystylebakedbeansplantbasedproteincannedbeans28oz,"BUSH'S Country Style Baked Beans, Plant Based Protein, Canned Beans, 28 oz"
78742369990-greatvaluecreamypeanutbutter18ounces,"Great Value Creamy Peanut Butter, 18 ounces"
78742433523-greatvaluedicedtomatoesintomatojuice145oz,"Great Value Diced Tomatoes In Tomato Juice, 14.5 Oz"
37100033188-libbyscutgreenbeans145ozcan,"Libby's Cut Green Beans, 14.5 Oz Can"
44000004637-honeymaidhoneygrahamcrackers144oz,"Honey Maid Honey Graham Crackers, 14.4 Oz"
75720334117-polandspringbrand100naturalspringwater1014ounceplasticjug,"POLAND SPRING Brand 100% Natural Spring Water, 101.4-ounce plastic jug"
17082876317-jacklinksoriginalbeefjerky285oz,"Jack Link's Original Beef Jerky, 2.85 oz"
78742230610-walmartgreatvaluethickcreamymacaronicheese725oz,"Walmart Great Value Thick & Creamy Macaroni & Cheese, 7.25 oz"
50000429448-fancyfeastgrainfreepatewetcatfoodclassicpatesavorysalmonfeast3ozcan,"Fancy Feast Grain Free Pate Wet Cat Food, Classic Pate Savory Salmon Feast, 3 oz. Can"
49000042559-cocacolazerosugarsodapop12floz12packcans,"Coca-Cola Zero Sugar Soda Pop, 12 Fl Oz, 12 Pack Cans"
49000042559-cocacolazerosugarsodapop12floz12packcans,"Coca-Cola Zero Sugar Soda Pop, 12 Fl Oz, 12 Pack Cans"
50000170166-24packfriskiesprimefiletswetcatfood55ozcansmultipleflavors,"(24 Pack) Friskies Prime Filets Wet Cat Food, 5.5 oz. Cans (Multiple Flavors)"
44000033255-oreodoublestufchocolatesandwichcookiesfamilysize20oz,"OREO Double Stuf Chocolate Sandwich Cookies, Family Size, 20 oz"
51000233141-campbellsspaghettios pastawithmeatballs156ounce can,"Campbell's SpaghettiOs Pasta with Meatballs, 15.6 Ounce Can"
78742061993-greatvaluenosaltaddedblackbeans1525ozcan,"Great Value,No Salt Added, Black Beans, 15.25 Oz Can"
78742061993-greatvaluenosaltaddedblackbeans1525ozcan,"Great Value,No Salt Added, Black Beans, 15.25 Oz Can"
41789002328-maruchanramennoodlebeefflavorsoup3oz12count,"Maruchan Ramen Noodle Beef Flavor Soup, 3 Oz, 12 Count"
78742030104-greatvaluechunkchickenbreastinwater125oz2countcan,"Great Value Chunk Chicken Breast, in Water, 12.5 oz, 2 Count Can"
78742030104-greatvaluechunkchickenbreastinwater125oz2countcan,"Great Value Chunk Chicken Breast, in Water, 12.5 oz, 2 Count Can"
49000019384-spritecaffeinefreelemonlimesodapop12floz24packcans,"Sprite Caffeine-Free Lemon Lime Soda Pop, 12 Fl Oz, 24 Pack Cans"
72486002205-jiffycornmuffinmix85oz,"Jiffy Corn Muffin Mix, 8.5 Oz."
41789002168-maruchanramennoodlesoupchiliflavor3oz,"Maruchan Ramen Noodle Soup Chili Flavor, 3 oz"
78742088198-greatvaluenoaddedsweeteners100applejuice64floz,"Great Value No Added Sweeteners 100% Apple Juice, 64 Fl. Oz."
41500220208-frenchsoriginalcrispyfriedonions6oz,"French's Original Crispy Fried Onions, 6 oz"
71100005516-hiddenvalleyoriginalranchsaladdressingtoppingglutenfree16ozbottle,"Hidden Valley Original Ranch Salad Dressing & Topping, Gluten Free - 16 oz Bottle"
46000288697-oldelpasotacoseasoningmixoriginal1oz,"Old El Paso Taco Seasoning Mix, Original, 1 oz"
37000716501-fixodentcompleteoriginaldentureadhesivecream24oz3pack,"Fixodent Complete Original Denture Adhesive Cream, 2.4 oz, 3 Pack"
46000288697-oldelpasotacoseasoningmixoriginal1oz,"Old El Paso Taco Seasoning Mix, Original, 1 oz"
12000809965-mountaindeworiginalcitrussodapop12floz12packcans,"Mountain Dew Original Citrus Soda Pop, 12 Fl Oz, 12 Pack Cans"
41789002311-maruchanramennoodlechickenflavorsoup3oz12count,"Maruchan Ramen Noodle Chicken Flavor Soup, 3 Oz, 12 Count"
41789002311-maruchanramennoodlechickenflavorsoup3oz12count,"Maruchan Ramen Noodle Chicken Flavor Soup, 3 Oz, 12 Count"
78742370361-greatvaluebakingsoda16oz,"Great Value Baking Soda, 16 oz"
78742054254-greatvaluecutgreenbeanscan28oz,"Great Value Cut Green Beans Can, 28 Oz"
644209311316-duncanhineschewyfudgechocolatebrowniemixfamilysize183ozbox,"Duncan Hines Chewy Fudge Chocolate Brownie Mix, Family Size, 18.3 Oz Box"
652729101133-eaglebrandsweetenedcondensedmilk14oz,"Eagle Brand Sweetened Condensed Milk, 14 oz"
652729101133-eaglebrandsweetenedcondensedmilk14oz,"Eagle Brand Sweetened Condensed Milk, 14 oz"
644209311316-duncanhineschewyfudgechocolatebrowniemixfamilysize183ozbox,"Duncan Hines Chewy Fudge Chocolate Brownie Mix, Family Size, 18.3 Oz Box"
78742369501-greatvaluetomatosauce8oz,"Great Value Tomato Sauce, 8 oz"
78742369440-greatvaluecutgreenbeans145ozcan,"Great Value Cut Green Beans, 14.5 Oz Can"
50000010516-nestlecarnationevaporatedmilkvitamindadded5floz,"Nestle Carnation Evaporated Milk, Vitamin D Added 5 fl oz."
70662096314-nissinbowlnoodleshotspicychickenflavorramennoodlesoup332oz,"Nissin Bowl Noodles Hot & Spicy Chicken Flavor Ramen Noodle Soup, 3.32 Oz"
681131699372-equateibuprofenpainrelieverfeverreducercoatedtablets200mg100count,"Equate Ibuprofen Pain Reliever/Fever Reducer Coated Tablets, 200mg, 100 Count"
70662096314-nissinbowlnoodleshotspicychickenflavorramennoodlesoup332oz,"Nissin Bowl Noodles Hot & Spicy Chicken Flavor Ramen Noodle Soup, 3.32 Oz"
681131699372-equateibuprofenpainrelieverfeverreducercoatedtablets200mg100count,"Equate Ibuprofen Pain Reliever/Fever Reducer Coated Tablets, 200mg, 100 Count"
49000028928-spritelemonlimesoda12floz12count,"Sprite Lemon-Lime Soda, 12 Fl. Oz., 12 Count"
49000028928-spritecaffeinefreelemonlimesodapop12floz12packcans,"Sprite Caffeine-Free Lemon Lime Soda Pop, 12 Fl Oz, 12 Pack Cans"
78742139845-greatvaluejelliedcranberrysauce14oz,"Great Value Jellied Cranberry Sauce, 14 Oz"
49000067217-cocacolaoriginalsodapop75floz10packcans,"Coca-Cola Original Soda Pop, 7.5 Fl Oz, 10 Pack Cans"
49000067217-cocacolaoriginalsodapop75floz10packcans,"Coca-Cola Original Soda Pop, 7.5 Fl Oz, 10 Pack Cans"
78742139845-greatvaluejelliedcranberrysauce14oz,"Great Value Jellied Cranberry Sauce, 14 Oz"
70662087237-nissinteriyakibeefflavorchowmeinnoodles4oz,"Nissin Teriyaki Beef Flavor Chow Mein Noodles, 4 oz"
13130006125-creamofwheatminutehotcerealoriginal28oz1packet,"Cream of Wheat, Minute Hot Cereal, Original, 28 oz, 1 Packet"
24000163022-delmontefreshcutgoldensweetwholekernelcorn1525ozcan,"DEL MONTE FRESH CUT Golden Sweet Whole Kernel Corn, 15.25 oz Can"
51500720011-jifcreamypeanutbutter40ouncejar,"Jif Creamy Peanut Butter, 40-Ounce Jar"
78742117713-greatvaluetomatoketchup24oz,"Great Value Tomato Ketchup, 24 oz"
78742117713-greatvaluetomatoketchup24oz,"Great Value Tomato Ketchup, 24 oz"
78742431079-greatvaluechiliwithbeans15oz,"Great Value Chili with Beans, 15 Oz"
78742431079-greatvaluechiliwithbeans15oz,"Great Value Chili with Beans, 15 Oz"
52100091501-mccormickchiliseasoningmix125oz,"McCormick Chili Seasoning Mix, 1.25 oz"
52100096902-mccormickaujusgravyseasoningmix1oz,"McCormick Au Jus Gravy Seasoning Mix, 1 oz"
52100034911-mccormickoriginaltacoseasoningmix1oz,"McCormick Original Taco Seasoning Mix , 1 oz"
38000138577-pringlespotatocrispschipslunchsnacksonthegosnackscheddarcheese55oz1can,"Pringles Potato Crisps Chips, Lunch Snacks, On The Go Snacks, Cheddar Cheese, 5.5oz, 1 Can"
78742110684-greatvaluesweetpeascannedsweetpeas15ozcan,"Great Value Sweet Peas, Canned Sweet Peas, 15 oz Can"
613008715267-arizonagreenteawithginsenghoney23floz,"Arizona Green Tea with Ginseng & Honey, 23 fl oz"
28400589864-cheetoscrunchycheeseflavoredsnacks85ozbag,"Cheetos Crunchy Cheese Flavored Snacks, 8.5 oz Bag"
28400589864-cheetoscrunchycheeseflavoredsnacks85ozbag,"Cheetos Crunchy Cheese Flavored Snacks, 8.5 oz Bag"
21000653713-kraftthickncreamymacaroniandcheesedinner725ozbox,"Kraft Thick 'n Creamy Macaroni and Cheese Dinner, 7.25 oz Box"
71100005783-hiddenvalleyglutenfreeoriginalranchsaladdressingstopping24floz,"Hidden Valley Gluten-Free, Original Ranch Salad Dressings & Topping, 24 Fl Oz"
51500255162-jifcreamypeanutbutter16ouncejar,"Jif Creamy Peanut Butter, 16-Ounce Jar"
51500255162-jifcreamypeanutbutter16ouncejar,"Jif Creamy Peanut Butter, 16-Ounce Jar"
43000955697-koolaidunsweetenedlemonadenaturallyflavoredpowderedsoftdrinkmix023ozpacket,"Kool-Aid Unsweetened Lemonade Naturally Flavored Powdered Soft Drink Mix, 0.23 oz Packet"
41460398887-pioneercountrygravymix275oz,"Pioneer Country Gravy Mix, 2.75 oz"
78742017860-greatvalueclassicranchdressingdip36floz,"Great Value Classic Ranch Dressing & Dip, 36 fl oz"
78742066844-greatvaluechickenbrothvaluesize48oz,"Great Value Chicken Broth Value Size, 48 oz"
78742066844-greatvaluechickenbrothvaluesize48oz,"Great Value Chicken Broth Value Size, 48 oz"
76410901374-lancesandwichcrackerstoastcheepeanutbutter8ctbox,"Lance Sandwich Crackers, ToastChee Peanut Butter, 8 Ct Box"
37297914475-eproduitalimentarefarinemais,E-PRODUIT ALIMENTARE FARINE MAIS
28400083140-tostitosscoopstortillachipspartysize145ozbag,"Tostitos Scoops! Tortilla Chips Party Size, 14.5 oz Bag"
28400147408-sunchipsgardensalsaflavoredwholegrainsnacks7ozbag,"SunChips Garden Salsa Flavored Whole Grain Snacks, 7 oz Bag"
28400147408-sunchipsgardensalsaflavoredwholegrainsnacks7ozbag,"SunChips Garden Salsa Flavored Whole Grain Snacks, 7 oz Bag"
21000039340-tacobelloriginaltacoseasoningmix1ozpacket,"Taco Bell Original Taco Seasoning Mix, 1 oz Packet"
28400002103-santitastortillachips11oz,"Santitas Tortilla Chips, 11 Oz."
28400002103-santitastortillachips11oz,"Santitas Tortilla Chips, 11 Oz."
78000083163-dietdrpeppersoda12flozcans12pack,"Diet Dr Pepper Soda, 12 fl oz cans, 12 pack"
49000045840-cokezerosugarsodasoftdrink169floz6pack,"Coke Zero Sugar Soda Soft Drink, 16.9 fl oz, 6 Pack"
49000045840-cokezerosugarsodasoftdrink169floz6pack,"Coke Zero Sugar Soda Soft Drink, 16.9 fl oz, 6 Pack"
30100112334-kelloggsclubcrackerslunchsnackpacksoriginal188ozbox9ct,"Kellogg's Club Crackers, Lunch Snack Packs, Original, 18.8oz Box, 9 Ct"
27000390146-huntstomatosauce100naturaltomatosauce15oz,"Hunt's Tomato Sauce, 100% Natural Tomato Sauce, 15 Oz"
27000390146-huntstomatosauce100naturaltomatosauce15oz,"Hunt's Tomato Sauce, 100% Natural Tomato Sauce, 15 Oz"
76406023103-jumexstrawberryandbanananectarfromconcentrate113floz,"Jumex Strawberry and Banana Nectar from Concentrate, 11.3 Fl. Oz."
49000050110-dietcokecolasodapop2literbottle,"Diet Coke Cola Soda Pop, 2 Liter Bottle"
76406023103-jumexstrawberryandbanananectarfromconcentrate113floz,"Jumex Strawberry and Banana Nectar from Concentrate, 11.3 Fl. Oz."
27000500064-huntstraditionalpastasauce100naturaltomatosauce24oz,"Hunt's Traditional Pasta Sauce, 100% Natural Tomato Sauce, 24 Oz"
27000500064-huntstraditionalpastasauce100naturaltomatosauce24oz,"Hunt's Traditional Pasta Sauce, 100% Natural Tomato Sauce, 24 Oz"
24300041334-littledebbiestrawberryshortcakerolls6ct130oz,"Little Debbie Strawberry Shortcake Rolls, 6 ct, 13.0 oz"
70847012474-monsterzeroultra16floz,"Monster Zero Ultra, 16 Fl Oz"
44000034207-belvitasoftbakedbananabreadbreakfastbiscuits176oz5count,"Belvita Soft Baked Banana Bread Breakfast Biscuits, 1.76 oz, 5 count"
12000004520-starbucksfrappuccinochilledcoffeedrinkmocha137ozglassbottle,"Starbucks Frappuccino Chilled Coffee Drink, Mocha, 13.7 oz Glass Bottle"
27000500118-huntsgarlicherbpastasauce100naturaltomatosauce24oz,"Hunt's Garlic & Herb Pasta Sauce, 100% Natural Tomato Sauce, 24 Oz"
27000500118-huntsgarlicherbpastasauce100naturaltomatosauce24oz,"Hunt's Garlic & Herb Pasta Sauce, 100% Natural Tomato Sauce, 24 Oz"
28400147392-sunchipsharvestcheddarflavoredwholegrainsnacks7ozbag,"SunChips Harvest Cheddar Flavored Whole Grain Snacks, 7 oz. Bag"
28400147392-sunchipsharvestcheddarflavoredwholegrainsnacks7ozbag,"SunChips Harvest Cheddar Flavored Whole Grain Snacks, 7 oz. Bag"
28400034005-rufflesoriginalpotatochipspartysize135ozbag,"Ruffles Original Potato Chips, Party Size, 13.5 oz Bag"
28400199148-laysclassicpotatochips8ozbag,"Lay's Classic Potato Chips, 8 oz Bag"
28400034005-rufflesoriginalpotatochipspartysize135ozbag,"Ruffles Original Potato Chips, Party Size, 13.5 oz Bag"
28400199148-laysclassicpotatochips8ozbag,"Lay's Classic Potato Chips, 8 oz Bag"
28400159388-rufflesoriginalpotatochips9ozbag,"Ruffles Original Potato Chips, 9 oz. Bag"
41000003622-3packliptononionsoupanddipmix2oz,"(3 Pack) Lipton Onion Soup and Dip Mix, 2 oz"
41000003622-liptonrecipesecretssoupanddipmixonion2oz,Lipton Recipe Secrets Soup and Dip Mix Onion 2 oz
38000138416-pringlesoriginalpotatocrispschips52ozcan,Pringles Original Potato Crisps Chips 5.2 oz can
28400589321-fritosscoopsoriginalcornchips925oz,"Fritos Scoops! Original Corn Chips, 9.25 Oz."
28400589284-fritoschilicheesecornchips925oz,"Fritos Chili Cheese Corn Chips, 9.25 Oz."
28400589321-fritosscoopsoriginalcornchips925oz,"Fritos Scoops! Original Corn Chips, 9.25 Oz."
28400589284-fritoschilicheesecornchips925oz,"Fritos Chili Cheese Corn Chips, 9.25 Oz."
49000050103-cocacolaoriginalsodapop2literbottle,"Coca-Cola Original Soda Pop, 2 Liter Bottle"
78742254593-greatvalueonionpowder325oz,"Great Value Onion Powder, 3.25 oz"
28400643061-doritosnаchocheeseflavoredtortillachipspartysize15oz,"Doritos Nаcho Cheese Flavored Tortilla Chips Party Size!, 15 oz"
28400641326-doritoscoolranchflavoredtortillachips975ozbag,"Doritos Cool Ranch Flavored Tortilla Chips, 9.75 oz Bag"
28400642033-doritosnachocheesetortillachips975oz,"Doritos Nacho Cheese Tortilla Chips, 9.75 Oz."
28400642255-doritosspicysweetchiliflavoredtortillachips975ozbag,"Doritos Spicy Sweet Chili Flavored Tortilla Chips, 9.75 oz Bag"
49000024692-dietcokebottles169floz6pack,"Diet Coke Bottles, 16.9 fl oz, 6 Pack"
28400642255-doritosspicysweetchiliflavoredtortillachips975ozbag,"Doritos Spicy Sweet Chili Flavored Tortilla Chips, 9.75 oz Bag"
28400642033-doritosnachocheesetortillachips975oz,"Doritos Nacho Cheese Tortilla Chips, 9.75 Oz."
28400641326-doritoscoolranchflavoredtortillachips975ozbag,"Doritos Cool Ranch Flavored Tortilla Chips, 9.75 oz Bag"
28400643054-doritoscoolranchflavoredtortillachipspartysize15ozbag,"Doritos Cool Ranch Flavored Tortilla Chips, Party Size, 15 oz Bag"
786162080004-vitaminwaterenergyelectrolyteenhancedwaterwvitaminstropicalcitrusdrink20floz,"vitaminwater energy electrolyte enhanced water w/ vitamins, tropical citrus drink, 20 fl oz"
28400589895-cheetoscrunchyflaminhotcheeseflavoredsnacks85ozbag,"Cheetos Crunchy Flamin' Hot Cheese Flavored Snacks, 8.5 oz Bag"
28400589895-cheetoscrunchyflaminhotcheeseflavoredsnacks85ozbag,"Cheetos Crunchy Flamin' Hot Cheese Flavored Snacks, 8.5 oz Bag"
28400240185-funyunsonionflavoredrings6ozbag,"Funyuns Onion Flavored Rings, 6 oz Bag"
49000067248-spritecaffeinefreelemonlimeminisodapop75floz10packcans,"Sprite Caffeine-Free Lemon Lime Mini Soda Pop, 7.5 Fl Oz, 10 Pack Cans"
49000067248-spritecaffeinefreelemonlimeminisodapop75floz10packcans,"Sprite Caffeine-Free Lemon Lime Mini Soda Pop, 7.5 Fl Oz, 10 Pack Cans"
27000388150-huntstomatopaste100naturaltomatoes6oz,"Hunt's Tomato Paste, 100% Natural Tomatoes, 6 Oz"
49000050158-spritecaffeinefreelemonlimesodapop2literbottle,"Sprite Caffeine-Free Lemon Lime Soda Pop, 2 Liter Bottle"
25500005188-folgersclassicmediumroastgroundcoffee48ozcan,"Folgers Classic Medium Roast Ground Coffee, 48 Oz, Can"
25500005188-folgersclassicmediumroastgroundcoffee48ozcan,"Folgers Classic Medium Roast Ground Coffee, 48 Oz, Can"
54100925022-armourviennasausageoriginal46ozcan,"Armour Vienna Sausage, Original, 4.6 oz Can"
78742114187-greatvaluegreatnorthernbeans155ozcan,"Great Value Great Northern Beans, 15.5 Oz Can"
14800000108-mottsapplesauce4ozcups6count,"Mott's Applesauce, 4 oz cups, 6 count"
78742018669-greatvalueminimarshmallows10oz,"Great Value Mini Marshmallows, 10 oz"
78742082554-greatvaluechunklighttunainvegetableoil5oz,"Great Value Chunk Light Tuna in Vegetable Oil, 5 oz"
10900003308-reynoldscutritewaxpaper,Reynolds Cut-Rite Wax Paper
644209307494-duncanhinesclassicyellowdeliciouslymoistcakemix1525oz,"Duncan Hines Classic Yellow Deliciously Moist Cake Mix, 15.25 Oz"
644209307494-duncanhinesclassicyellowdeliciouslymoistcakemix1525oz,"Duncan Hines Classic Yellow Deliciously Moist Cake Mix, 15.25 Oz"
41789002113-maruchanramennoodlechickenflavorsoup3oz,"Maruchan Ramen Noodle Chicken Flavor Soup, 3 Oz"
41789002144-maruchanramennoodleorientalflavorsoup3oz,"Maruchan Ramen Noodle Oriental Flavor Soup, 3 Oz"
41789001574-maruchaninstantlunchroastchickenflavorsoup225oz,"Maruchan Instant Lunch Roast Chicken Flavor Soup, 2.25 Oz"
41789001314-maruchaninstantlunchchickenflavorramennoodlesoup225oz6count,"Maruchan Instant Lunch Chicken Flavor Ramen Noodle Soup, 2.25 oz, 6 count"
41789001437-maruchaninstanthotspicychickenramennoodlesoup225oz,"Maruchan Instant Hot & Spicy Chicken Ramen Noodle Soup, 2.25 oz"
605388187925-greatvaluespaghettiringspastawithmeatballsintomatosauce15oz,"Great Value Spaghetti Rings Pasta with Meatballs in Tomato Sauce, 15 oz"
888109150044-hostessdonettespowderedminidonuts105oz20count,"Hostess Donettes Powdered Mini Donuts 10.5 Oz, 20 Count"
37600138727-spamclassic7gofprotein12oz,"SPAM Classic, 7 g of protein, 12 oz"
37600241939-hormelchilinobeansnoartificialingredients15oz,"HORMEL Chili, No Beans, No Artificial Ingredients, 15 oz"
37600223188-hormelchiliwithbeansnoartificialingredients15oz,"HORMEL Chili with Beans, No Artificial Ingredients, 15 oz"
37600241939-hormelchilinobeansnoartificialingredients15oz,"HORMEL Chili, No Beans, No Artificial Ingredients, 15 oz"
39400018803-bushsblackbeanscannedbeans15oz,"BUSH'S Black Beans, Canned Beans, 15 Oz"
39400018803-bushsblackbeanscannedbeans15oz,"BUSH'S Black Beans, Canned Beans, 15 Oz"
24300041068-littledebbiecosmicbrownies13oz,"Little Debbie Cosmic Brownies, 13 oz"
49000042849-cocacolazerosugarcans12floz24pack,"Coca-Cola Zero Sugar Cans, 12 fl oz, 24 Pack"
44000002930-chickeninabiskitoriginalbakedsnackcrackersfamilysize12oz,"Chicken in a Biskit Original Baked Snack Crackers, Family Size, 12 oz"
44000002930-chickeninabiskitoriginalbakedsnackcrackersfamilysize12oz,"Chicken in a Biskit Original Baked Snack Crackers, Family Size, 12 oz"
39400019770-bushsbrownsugarhickorybakedbeanscannedbeans28oz,"BUSH'S Brown Sugar Hickory Baked Beans, Canned Beans, 28 oz"
39400019770-bushsbrownsugarhickorybakedbeanscannedbeans28oz,"BUSH'S Brown Sugar Hickory Baked Beans, Canned Beans, 28 oz"
24300041464-littledebbiezebracakes13oz,"Little Debbie Zebra Cakes, 13 oz"
50000103867-fancyfeastgrainfreepatewetcatfoodclassicpatesalmonshrimpfeast3ozcan,"Fancy Feast Grain Free Pate Wet Cat Food, Classic Pate Salmon & Shrimp Feast, 3 oz. Can"
78742369785-greatvaluemediumpittedblackolives6oz,"Great Value Medium Pitted Black Olives, 6 oz"
78742369785-greatvaluemediumpittedblackolives6oz,"Great Value Medium Pitted Black Olives, 6 oz"
